409,,,,2002,"Sydney bushfires contained, 10 homes razed OCT 8",,"CTV.ca",,,,,,,,,,,,,,,,,,,,,"media","The charred remains of 10 homes in suburban Sydney continued to smoulder Wednesday, as firefighters contained the bushfires that destroyed the houses and forced around 200 people to be evacuated. 

Australia's bushfire season officially opens on Oct. 1 and runs until February, but firefighters have been battling blazes for two months already.

On Tuesday, soaring temperatures, strong winds, and low humidity fanned the bush and grass fires in drought-striken New South Wales and in suburban Sydney. There were 47 fires near Sydney alone.

""It's a timely reminder to us, I think, that New South Wales, being one of the most fire-prone areas in the world, is not going to escape the impact of a drought such as we are currently experiencing,"" New South Wales fire commissioner Phil Koperberg said.

At least 10 homes were destroyed in Sydney's southern suburb of Engadine. Another 11 homes were severely damaged in north-west. No one was injured.

Those fires have now been contained, but about 70 are still burning along Australia's tinder-box dry east coast.

""The plan for today is to go in and mop these fires up. They are all but contained around Sydney. Obviously there is a lot of work to do on the fires in the rest of the state,"" John Winter from the New South Wales Rural Fire Service said on Wednesday.

While many of the fires were sparked by lightning strikes over the past week, authorities suspect some of the fires may have been accidentally or deliberately set.

In Engadine, police are investigating reports a maintenance crew may have sparked a fire while using power tools to fix water pipeline leaks.

Sydney Water has launched its own investigation into maintenance work, and said it would compensate families if it was found to be at fault.

The drought in New South Wales, compounded with El Nino weather and Sydney's third driest weather on record could contribute to one of the worst bushfire seasons on record.

Last Christmas, a bushfire burned through 770,000 hectares and destroyed 109 homes in Sydney. Australia's most deadly fire swept through Victoria and New South Wales in 1983, killing 76 people.",,,,,,,,,,"http://www.ctv.ca/servlet/ArticleNews/story/CTVNews/1034117617782_78/?hub=World",,
343,,,,2006,"nov 12: NSW: Massive Sydney factory fire burns out of control",,"aap",,,,,,,,,,,,,,,,,,,,,"media","AAP General News (Australia) 
11-12-2006 
NSW: Massive Sydney factory fire burns out of control 

SYDNEY, Nov 12 AAP - A massive factory fire is burning out of control in Lidcombe, 
in Sydney's west. 

Up to 20 fire trucks and 80 firefighters are ...",,,,,,,,,,"http://www.highbeam.com/doc/1P1-131062323.html",,
349,,,,2006,"Perth fire believed to be contained 12 DEC",,"Sydney Morning Herald",,,,,,,,,,,,,,,,,,,,,"media",,,,,,,,,,,,,
410,,,,2002,"Oct 4: NSW: Eight houses evacuated due to large grass fire",,"Asia Africa Intelligence Wire",,,,,,,,,,,,,,,,,,,,,"media","SYDNEY, Oct 4 AAP - A bushfire in Sydney's west has killed three horses and forced the evacuation of eight houses, police said today. A police spokesman said the animals were killed after fire broke out on a 50 hectare semi-rural property in Eastern Creek at about 1.15pm (AEST). ""There were eight houses evacuated ...",,,,,,,,,,"http://www.accessmylibrary.com/coms2/summary_0286-26157091_ITM",,
245,,,,2003,"sept 4: a couple hotspots with vis smoke in newcastle region, some in illawarra, and a couple with no vis smoke in syd region shown in two photos",,"modis",,,,,,,,,,,,,,,,,,,,,"modis smoke","2nd url:  http://rapidfire.sci.gsfc.nasa.gov/realtime/single.php?2003247/crefl2_143.A2003247034500-2003247035000.500m.jpg",,,,,,,,"changed to prescribed burn and 4th to 6th after reading article",,"http://rapidfire.sci.gsfc.nasa.gov/realtime/single.php?2003247/crefl2_143.A2003247035000-2003247035500.500m.jpg",,
390,,,,2002,"jan 4: Australian Bushfires Blaze Out of Control",,"Environment News Service",,,,,,,,,,,,,,,,,,,,,"media","SYDNEY, Australia, January 4, 2002 (ENS) - Nearly 20,000 exhausted firefighters are struggling to contain at least 80 fires blazing across New South Wales today. No lives have been lost, but an estimated 170 homes have been burned. 

The worst of the fires is threatening the towns of Woodford and Faulconbridge in the Blue Mountains west of Sydney. Some fires in Sydney's northern suburbs have been contained, but smoke hangs over the city and nearby Albion Park. 


Rural Fire Service Commissioner Phil Koperberg (Photo courtesy RFS)
In view of the weather forecast for high summer temperatures, low humidity and strong winds, Rural Fire Service Commissioner Phil Koperberg says there is no end in sight to the bushfires. He has declared a total fire ban for the entire state of New South Wales - no fire of any kind may be lit in the open. 
More than 70 aircraft are still dropping water and fire retardant on the stubborn bushfires that broke out on Christmas Day. 

Hundreds of firefighters have been treated for injuries, and close to 50 have been taken to hospitals. On Thursday, one firefighter battling a blaze near Oberon, west of the Blue Mountains, was rushed to hospital with burns to his feet. 


Australian bushfire (Photo courtesy CSIRO)
Many of the fires appear to have been deliberately set. Police have arrested 23 arson suspects, most are male teenagers, but a 14 year old girl was arrested yesterday. 
New South Wales Premier Bob Carr told reporters he plans to take young arsonists ""by the scruff of the neck"" and make them face the horror of what they had done. 

To finally douse the fires, Australian officials have pinned their hopes on help from the United States in the form of two large firefighting helicopters from Erickson Air-Crane Inc. of Central Point, Oregon. They are renting the two choppers that can take up 3,500 gallons of water in 45 seconds and release it to douse the flames. But a record snowstorm in Atlanta, Georgia yesterday grounded the Antanov cargo plane chartered to fly the Air-Cranes from Oregon to Sydney. 


An Erickson Air-Crane drops fire retardent in Oregon. (Photo by Kari Brown courtesy Erickson Air-Crane)
Minister for Emergency Services, Bob Debus, who represents the Blue Mountains in the New South Wales Parliament, said the local authorities should be helped to improve procedures for burning off excess forest fuels in advance of the summer bushfire season. 
Since the bushfires broke out, 400 State Emergency Service (SES) volunteers have been supporting the Rural Fire Service removing dangerous trees, securing hazardous buildings, readying for evacuation. ""Every volunteer on one of our crews in the field has, at a minimum, training in general rescue, teamwork, working with the public, first aid and radio communication,"" said Mim Humphries, SES deputy division controller for the Sydney Southern Division, who has been coordinating SES assistance from the Rural Fire Service Incident Management Centre at Picton. 

The NSW National Parks and Wildlife Service is currently managing 50 bushfires on national parks and reserves. Fires are burning on at least 355,000 hectares (877,205 acres) of protected bushland. One of the parks on fire is Blue Mountains National Park, part of the massive Greater Blue Mountains World Heritage Area which contains. 


The Wollemi Pine found only in the Blue Mountains' Wollemi National Park (Photo courtesy Royal Botanic Gardens Sydney)
The Blue Mountains area has one of the highest numbers of threatened plant species in Australia. Some species are found nowhere else in the world. More than 90 different eucalypt species are found in the Greater Blue Mountains – 13 percent of all eucalypt species in the world. The blue mist covering the landscape is produced by the eucalypt forests, which release fine droplets into the air. 
Throughout the state’s pine plantations, state forests’ staff is on alert for fires, manning fire towers, fire control rooms and various field locations where fire fighting units are positioned. 

State Forests’ Monaro regional manager, Graham Gray said, State Forests’ staff would be on their toes to protect life, property and the state’s valuable softwood resource throughout this fire season, which could last until April. 

NSW National Parks and Wildlife Service says that before the colonization of Australia, Aboriginal people used planned fires to create a mosaic pattern of vegetation of different ages. Since the arrival of European settlers, bushfires have become more frequent and more intense.",,,,,,,,,,"http://www.ens-newswire.com/ens/jan2002/2002-01-04-01.asp",,
766,,,,1994,"Dec 20: Wildfire Sydney (Blue Mountains)",,"Ross Bradstock",,,,,,,,,,,,,,,,,,,,,"government","wf = unplanned (""wild"")fire, bm = blue mountains",,,,,,,,,,"M:\Environmental_Health\Bushfires\Exposures\NSW\validate events\Geoff's old work\fire-pm10days_final.xls",,
350,,,,2006,"additional media coverage for  Decmebre 12: Perth fire believed to be contained",,"the sydney morning herald",,,,,,,,,,,,,,,,,,,,,"media","A large bushfire in Perth's hills which destroyed one house and damaged two others has been contained, firefighters say.

The fire broke out about 12.30pm (WDT) on Tuesday in the suburb of Kalamunda.

The Fire and Emergency Services Association (FESA) says 17 crews will work through the night to mop up the fire, but the threat to lives and property has been significantly reduced.

Three helicopters and two fixed-wing aircraft helped firefighters contain the blaze.

Two houses in Persimmon Place caught alight, with one destroyed and another significantly damaged, FESA said in a statement.

Both fires are believed to have been started when embers from the bushfire entered evaporative air-conditioners in the houses.

A third house received minor damage.

Two firefighters have been treated for smoke inhalation.

Police said several roads in the area would remain closed for some time and urged people to stay away.

Fire authorities are investigating what caused the bushfire",,,,,,,,,,"http://www.smh.com.au/news/National/Bushfire-threatens-homes-in-Perth-hills/2006/12/12/1165685670709.html",,
31,,,,2005,"Winds cause new fire concerns in Perth jan 13-23",,"theage.com",,,,,,,,,,,,,,,,,,,,,"media","Soaring temperatures and gusty winds could reignite a deliberately-lit bushfire that has razed more than 27,000 hectares of land in Perth's Hills area.

Firefighters fear the blaze could flare up again because of today's intense weather conditions, said Fire and Emergency Services Authority spokesman Craig Waters.

Already, Perth is choking from the worst pollution ever recorded in the city - caused by a smoke haze which has blanketed the metropolitan area since Wednesday.

The Hills fire is the worst in Perth in 45 years.

FESA said today it was keeping a full fire-fighting crew in the Hills.

""It is a big worry with the high temperatures and the gusty winds,"" Mr Waters said.

""The possibility of the fire flaring up and restarting is very real.""

Perth is expected to top 40 degrees today.

Yesterday, a new task force of firefighters from the volunteer bush fire brigade and the Conservation and Land Management department joined career firefighters in 24 fire-fighting vehicles to patrol the blaze.

Advertisement
AdvertisementThe fire had threatened hundreds of homes in semi-rural areas including Mundaring, Chidlow, Sawyers Valley, and Mahogany Creek, prompting warnings to residents living within 100 metres of bushland to remain on alert for further outbreaks.

For the past few days, Perth has been shrouded in smoke as firefighters work round the clock to consolidate containment lines ahead of the predicted rise in temperatures this weekend.

The smoke haze that has blanketed the metropolitan area since Wednesday was yesterday confirmed as the worst pollution ever recorded in the city.

The Department of Environment's air quality division said the smoke pollution levels were, at times, more than twice the national standard of 50 micrograms per cubic metre.

Meanwhile, officers also battled a bushfire in Perth's northern suburbs overnight that is believed to have been deliberately lit.

The fire at Carramar broke out about 3pm (WST) yesterday, nearby to a pine plantation, Mr Waters said.

Although no homes were threatened by the blaze, officers would have had a hard job fighting the fire if it had reached the plantation, he said.

""Fortunately, it was brought under control and we have crews there now mopping up but the pine plantation was under threat at one stage,"" he said.

It is believed the blaze was also deliberately lit.

- AAP",,,,,,,,,,"http://www.theage.com.au/news/national/winds-cause-new-fire-concerns-in-perth/2005/01/23/1106415441929.html",,
614,,,,2009,"mar 5: Gas cylinder on fire sydney",,"the australian",,,,,,,,,,,,,,,,,,,,,"media","A ONE-KILOMETRE evacuation zone has been set up around a factory in Sydney's south-west following a gas explosion.

About 7pm (AEDT) yesterday a 5000 litre lpg gas cylinder caught alight in an engineering factory at Graham Hill Road, Narellan. 

It took about 70 fire fighters two hours to contain and extinguish the blaze. 

""We have an aggressive high pressure gas fire which threatened to spread to several nearby factory complexes,"" Superintendent Ian Krimmer from the NSW fire brigade said.

""Fortunately we are in a industrial area and no residents have been impacted."" 

""There's only been minor damage to a workshop area.""

A one kilometre evacuation zone has been set up around the factory as a precautionary measure, Supt Krimmer said.

A full investigation of the incident will be conducted by Workcover and fire authorities this morning.",,,,,,,,,,"http://www.theaustralian.news.com.au/story/0,25197,25141467-12377,00.html",,
55,,,,2001,"Fresh Fears over inferno dec 26 sydney",,"bbc news",,,,,,,,,,,,,,,,,,,,,"media","Bush fires stretching across 700 kilometres (420 miles) in eastern Australia could get worse and burn out of control for 10 days, fire chiefs have warned. 
About 140 homes have burned down and thousands of people have been evacuated amid fears that more houses will soon be lost. 

More than 100 fires are blazing near Australia's biggest city Sydney. They are being fuelled by strong winds to the north, south and west. 



Flame red sky over the Sydney to Hobart boat race
 
The front line stretches for more than 700 kilometres (450 miles), creating an arc of devastation around the city. 

Reinforcements have been flown in from the neighbouring state of Victoria to join the battle against the flames. Hundreds of firefighters are also on standby in South Australia. 

Dozens of emergency workers have been treated for minor burns but there are no reports of serious injuries. 

The navy has sent in five helicopters to help evacuate towns on the front line. 

The New South Wales state government has declared at least 20 disaster zones. 



Sydney's farmous landmark is partly obscured by smoke
 
Towns, holiday resorts and national parks have been evacuated. 

Sydney is blanketed in smoke haze and there is concern about blazes on the north-western outskirts. 

The authorities believe most of the fires were started deliberately - and they say they're making progress in finding the culprits.",,,,,,,,,,"http://news.bbc.co.uk/2/hi/asia-pacific/1728015.stm",,
78,,,"mcdonald, phillipa",2002,"dec 21-jan 5 sydney",,"am abc local radio",,,,,,,,,,,,,,,,,,,,,"media","NARELLE HOOPER: As the New South Wales bushfires burn into their second terrible week, there's no relief in sight for weary fire fighters with hot and gusty conditions predicted again for today. 

Soaring temperatures brought the devastation towards the centre of Sydney yesterday with hundreds of residents in the city's north west on evacuation alert as fires crept dangerously close to their homes. Today is expected to be slightly cooler than yesterday's maximum of 37 but forecasters are predicting horror winds for fire fighting. 

Sue Kidd was given just one minute to evacuate her home in the Sydney suburb of South Turramurra which was also threatened during the bushfire crisis of 1994.

SUE KIDD: We were just standing there looking at the fires and we actually felt the real intensity of the heat coming through and all of us have been here since 1994 when those bushfires were on and we all said this is worse and it was because in 1994 we didn't get evacuated - this street. Bowen Avenue, Ashburton did but we didn't but this time we just got told, you know, the police came through and just said you've got to evacuate. My next door neighbour said give me 2 minutes, you've got 50 seconds.

PHILIPPA McDONALD: That's how bad it was.

SUE KIDD: Well that's how bad it was. It's just the fact that you just couldn't see. We didn't see the flames where I was but we didn't go up to the end of the street and now that always gets, that's where the wind tunnel is and that's right on the bush. Whereas we have a small little inlet and that's the problem with any cinders coming down and if those cinders go down, then you can actually go both ways.

PHILIPPA McDONALD: What are you told about what might happen today?

SUE KIDD: I'm hoping and I'm praying that we don't get hit but yesterday they just sort of said, well the police said after we evacuated and we were told to come back, they said there's not much left around there to burn out but we just don't know.

NARELLE HOOPER: South Turramurra resident, Sue Kidd, with Aims Philippa McDonald.",,,,,,,,,,"http://www.abc.net.au/am/stories/s450611.htm",,
80,,,"marks, Kathy",2002,"dec 21-jan 10 Dancing to the fire gods' tune",,"nzherald.co.nz",,,,,,,,,,,,,,,,,,,,,"media","Sydneysiders are feeling claustrophobic as nature crowds in, reports KATHY MARKS.

SYDNEY - For nearly a fortnight, vast bushfires have been closing in on Sydney. Now residents are asking the unthinkable: is it too late to stop the inferno?

The fire gods are laughing. They watch as mortals scurry to fight an unequal battle against an elemental force threatening to devour the fruits of their carefully constructed lives.

The firefighters dash from place to place. Each time they appear to be getting the upper hand, the gods snap their fingers and shower yet more flames across the landscape.

These are terrifying times in eastern New South Wales. Each day brings more bad news as the wildfires, raging since Christmas Eve, spread out of control and fresh fires start in new spots.

There is fire in the mountains, fire on the coast and fire in the Sydney suburbs, just 16km from the Opera House. The city is choked by a pall of smoke and locals wear gauze masks as they jog on the beaches.

In northwestern Sydney, flames licked at some of the city's most exclusive properties after a blaze that broke out on New Year's Day raced along a corridor of parkland. 

In one backyard, three men wearing bandanas across their faces crouched by a swimming pool, desperately scooping out water with buckets and throwing it on to burning bushes.

More than 80 bushfires are blazing around the state, each unpredictable. With the hot, dry winds that are the ally of the bushfires forecast to continue, no respite is in prospect for exhausted firefighters and demoralised residents.

The smoke, combined with daily temperatures of 38 degrees, has created a feeling of claustrophobia as nature crowds in on Sydney. Outside the city, the magnificent Australian bushland is a scorched mess.

The worst effects - smoke inhalation, stress, minor burns - have been felt by those on the front line: the firefighters, most of them volunteers, who have poured into New South Wales from around Australia. 

No human lives have been lost, but tens of thousands of sheep and native animals, including wombats and kangaroos, have been killed.

Neither the forces of nature nor the gods are entirely to blame for the crisis gripping Australia's most populous state.

Some of the fires were started by lightning strikes in western New South Wales. But half the blazes threatening homes and lives are believed to have been deliberately lit.",,,,,,,,,,"http://www.nzherald.co.nz/world/news/article.cfm?c_id=2&objectid=584982",,
83,,,,2002,"dec 25-jan 16 rain brings end to bushfire crisis",,"tvnz",,,,,,,,,,,,,,,,,,,,,"media","Australian firefighters battling the fiercest bushfires around Sydney in about eight years declared an end to the crisis on Wednesday after heavy overnight rain doused most of the remaining blazes.

While the storm that moved up the Sydney coast during the night brought relief to the firefighters, it also delivered a cruel blow to one household.

Police said a home in a city suburb near the frontline of the battle against the bushfires, which just managed to escape being engulfed in flames, was struck by lightning on Tuesday evening and burned to the ground.

Fanned by high summer temperatures and strong winds, the fires began in earnest on Christmas Day and destroyed at least 110 homes near Australia's largest city before being brought more or less under control earlier this month.

Thousands of voluntary firemen were drafted in to help regular emergency services staff combat the flames, which charred an area of bush almost three times the size of Greater London, or more than 500,000 hectares.

""After one of the most protracted bushfire fighting campaigns in our state's history, it is clear that the weather has finally turned in our favour,"" said New South Wales Rural Fire Service commissioner Phil Koperberg in a statement.

""While the crisis point is now passed, the work goes on for our volunteer firefighters who will continue to monitor over 3,200 km of fire perimeter to ensure there are no break-outs or re-ignitions of the fires.""",,,,,,,," Note: this is a good summary of the bushfire activity in the region from the noted dates.",,"http://tvnz.co.nz/content/76752",,
95,,,,2002,"Firefighters race against clock to contain blazes nov 11",,"smh.com.au",,,,,,,,,,,,,,,,,,,,,"media","Firefighters are racing against time to contain fires raging across NSW before weather conditions worsen, with 90 fires still burning - 30 of them out of control.

NSW Rural Fire Service spokesman Cameron Wade said conditions were likely to deteriorate in the next few days.

""It's a race against the clock ... we are expecting worse weather tomorrow and especially on Wednesday,"" he said.

""Even if we do get them contained, there is a threat of them getting out of control if we have weather like Saturday.""

There are 90 fires still burning across NSW, with 30 of them out of control in Mittagong and the Hunter region.



   advertisement 
    
   advertisement 

Mr Wade said today's cooler weather was helping, although it hampered back burning operations in some parts of the state last night.

Meanwhile, a man has been charged with causing a fire that destroyed bushland north-west of Sydney, police said today.

Arsonists also were thought to be responsible for a ferocious bushfire which raged through the small southern highlands town of Willow Valley on Saturday afternoon, destroying five homes.",,,,,,,,,,"http://www.smh.com.au/articles/2002/11/11/1036308616957.html",,
110,,,,2006,"WA firefighters control one side of Dwelingup blaze jan 23",,"aap australian general news",,,,,,,,,,,,,,,,,,,,,"media","AAP General News (Australia) 
01-23-2006 
WA: WA firefighters control one side of Dwellingup blaze 

PERTH, Jan 23 AAP - Firefighters are winning on one front of a battle to contain a 
bushfire that could pose a threat to four West Australian communities. 

Six water-bombing aircraft and 160 firefighters battled the blaze today in steep terrain 
and gusty conditions near Dwellingup, 97km south-east of Perth. 

By midday, crews had managed to contain the fire on the east side of the Murray River, 
Department of Conservation and Land Management (CALM) state duty officer Terry Maher said. 

""There is still a chance the fire could grow in size before being contained around 
the perimeter,"" Mr Maher ...",,,,,,,,,,"http://www.highbeam.com/doc/1P1-117676267.html",,
121,,,,2005,"Bushfire Blankets Perth in Smoke jan 19",,"abc online",,,,,,,,,,,,,,,,,,,,,"media","A thick smoke haze is blanketing Perth as firefighters work to prevent a fresh outbreak reaching homes in the community of Mundaring.

Emergency services remain under pressure as they continue efforts to contain a major bushfire which has now been burning out of control for four days. 

The fire is burning on the eastern side of Lake O'Connor at Mundaring. 

The Fire and Emergency Services Authority (FESA) has advised residents at Mount Helena, Chidlow, Mundaring and nearby areas to prepare for the passage of the fire. 

Bruce Jones from FESA says one of the immediate hazards comes from smoke. 

""We've got an extremely heavy smoke haze right across Perth and surrounding areas and that's creating issues with driving conditions,"" he said. 

FESA has warned the fire remains a risk to lives and property. 

Motorists have been asked to use headlights at all times.",,,,,,,,,,"http://www.abc.net.au/cgi-bin/common/printfriendly.pl?http://www.abc.net.au/news/newsitems/200501/s1284590.htm",,
