468,,,,2001,"Nov 2: NSW: Bushfires under control but firefighters watching wind",,"aap",,,,,,,,,,,,,,,,,,,,,"media","Bushfires are continuing to burn out of control mainly in northern New South Wales, 
but homes are no longer under threat. 
NSW Rural Fire Service spokesman JOHN WINTER says 15 fires are still of concern, especially 
near Kempsey, Singleton, Walcha, and Tenterfield. 
Mr WINTER says firefighters also are concerned about 53 other blazes that are under 
control, but listed as significant. 
The wind is expected to rise again this afternoon, which could either force the .",,,,,,,,,,"http://www.highbeam.com/doc/1P1-47887289.html",,
469,,,"O'Leary, Wade",2001,"Nov 2:NSW: Bushfires continue to burn",,"aap",,,,,,,,,,,,,,,,,,,,,"media","SYDNEY, Nov 2 AAP - Hot weather and strong winds appear likely to condemn a third of 
NSW to a weekend of bushfires, most deliberately lit. 
More than 60 bushfires are burning across 28,000 hectares in the State's north and 
Central Coast, NSW Premier Bob Carr said today, adding that it was likely to continue. 
Mr Carr spent the morning with firefighters on the Central Coast following a blaze 
that ripped through 250 hectares of bush on Wednesday, threatening more than 20 homes 
in Wyong. 
""I could not bring them any good news because the weather, the wind, the humidity and 
the heat all (make it) look ...",,,,,,,,,,"http://www.highbeam.com/doc/1P1-47902985.html",,
616,,,,2003,"jan 18: Fire threatens North Sydney homes",,"abc news online",,,,,,,,,,,,,,,,,,,,,"media","A large bushfire burning in Sydney's northern suburbs is expected to intensify and threaten hundreds of nearby homes.

Strong gusty winds are causing havoc for firefighters battling the Forestville blaze.

Southerly winds are expected to reach gusts of up to 50 kilometres an hour tonight which is likely to cause the fire to cross a creek in the Garigal National Park and burn towards the suburbs of Davidson and Belrose. 

Andrew Shea from the New South Wales Rural Fire Service says fluctuating conditions are hampering efforts to contain the blaze to the southern fringes of the National Park. 

""There is some concern tonight about gusting winds from the south which may cause the fire to spot to the northern side of Carol Creek,"" Mr Shea said.

""If that happens fire fighters face a difficult task protecting hundreds of nearby homes. 

""They are currently backburning in the area hoping it will stop the fire spreading",,,,,,,,,,"http://www.abc.net.au/news/newsitems/200301/s765627.htm",,
607,,,,2005,"nov 25: several hs in perth, no vis smoke",,"modis",,,,,,,,,,,,,,,,,,,,,"modis hotspot",,,,,,,,,,,"http://rapidfire.sci.gsfc.nasa.gov/realtime/single.php?2005329/crefl1_143.A2005329.0220.005.2005329104940.500m.jpg",,
471,,,,2006,"Oct 8: single hs vis in Sydney and one in illawarra region no vis smoke, possible biomass",,"modis",,,,,,,,,,,,,,,,,,,,,"modis hotspot",,,,,,,,,,,"http://rapidfire.sci.gsfc.nasa.gov/realtime/single.php?2006281/crefl1_143.A2006281001000-2006281001459.500m.jpg",,
476,,,,2007,"Jan 20:single (fairly large) hs vis in illawarra region, no vis smoke. Possible biomass",,"Modis",,,,,,,,,,,,,,,,,,,,,"modis hotspot",,,,,,,,,,,"http://rapidfire.sci.gsfc.nasa.gov/realtime/single.php?2007020/crefl2_143.A2007020034001-2007020034500.500m.jpg",,
608,,,,2006,"jan 23: large hs vis with massive vsi smoke southeast of perth",,"modis",,,,,,,,,,,,,,,,,,,,,"modis smoke",,,,,,,,,,,"http://rapidfire.sci.gsfc.nasa.gov/realtime/single.php?2006023/crefl1_143.A2006023020000-2006023020459.500m.jpg",,
472,,,,2003,"Dec 26: single hs vis in syd and nc, no vis smoke, possible biomass",,"modis",,,,,,,,,,,,,,,,,,,,,"modis hotspot",,,,,,,,,"NOTE changed to bushfire after consult other refs",,"http://rapidfire.sci.gsfc.nasa.gov/realtime/single.php?2003360/crefl1_143.A2003360002001-2003360002501.500m.jpg",,
615,,,,2003,"jan 19: Sydney fires under control",,"the age",,,,,,,,,,,,,,,,,,,,,"media","Firefighters have worked through the night to bring a blaze in Sydney's north under control but Snowy Mountains bushfires were still causing problems, the NSW Rural Fire Service said.

Last night, firefighters were dug in along a line separating Forestville from the neighbouring suburb of Davidson, tackling the fire in Sydney's north.

NSW Rural Fire Service (RFS) spokesman John Winter said that fire was now ""all but contained"".

""We have a little more work to do this morning but we're optimistic that we'll hold the (containment) line on that,"" he said.

Fire crews' swift response to the blaze early yesterday afternoon had prevented property loss.



   advertisement 
    
   advertisement 

""They got there extremely quickly last night,"" Mr Winter said.

""The only damage was to one house and was minor.


Milder conditions and light rain in the Sydney area late on Thursday and early on Friday have helped the RFS extinguish the blaze near Londonderry Road at Londonderry, which destroyed numerous trucks, cars and sheds but no properties on Thursday.

""We have had crews on the fire grounds overnight monitoring the fires and they will continue to monitor them throughout the day,"" RFS spokesman Anthony Clark said.

The blaze in Mount Kuring-gai in Sydney's north had also been contained, a spokeswoman for NSW Fire Brigades told AAP, with patrols working to ensure there were no further flare-ups.

""They've still got a lot of smoke in the area and there's little stumps still smouldering, but basically it's all over and done with,"" she said.

The blaze, at the rear of a factory complex on Gundah Road, resulted in the evacuation of workers at 15 factories and destroyed a silo at the Artarmon Joinery, which stored wood chips.

The only fire still burning out of control in the state was at an air force bombing range at Evans Head on the NSW north coast.

The state's north had not yet been blessed with the cool change and rain that has bought relief to the state's western and southern areas, RFS spokesman Keiran Smith said.

""That's not expected to reach until later this afternoon,"" he said.

""There'll still be hot, dry conditions until then.""

The RFS were backburning in the area on Friday morning in an attempt to contain the blaze, which forced some campers to be relocated on Thursday.

A grass fire within a bomb impact zone of the army range in Singleton in the Hunter Valley was also continuing to smoulder and the army was monitoring the blaze, Mr Smith said.

The RFS had had difficulties fighting the Singleton fire because they had been unable to enter the army base due to a risk of unexploded ordinance, he said.

But he said there was no reason to believe that the fire had been caused by army bombs or ordinance.

""The fire was near the boundary of the army base there but there are no reports of how it started,"" he said.

The Department of Defence, which is now managing the situation, has not immediately replied to a request for information.

The RFS said hundreds of lightning strikes across the state on Thursday could have started new fires.

""We have aircraft up now monitoring remote areas of the state to see if there are any smoke columns coming from those lightning strikes,"" Mr Smith said.

""We know the one in Lithgow (in central western NSW) is already contained.

""The one at Braidwood (in the state's south), we haven't heard any reports of that escalating but we'll obviously monitor that with aircraft,"" he added.

Mr Smith said higher levels of humidity across the state would help to ease conditions on Friday. AAP",,,,,,,,,,"http://www.theage.com.au/articles/2003/01/19/1042911262832.html",,
609,,,,2006,"may 8: many hs all around perth, vis smmoke?",,"modis",,,,,,,,,,,,,,,,,,,,,"modis hotspot",,,,,,,,,,,"http://rapidfire.sci.gsfc.nasa.gov/realtime/single.php?2006128/crefl2_143.A2006128061000-2006128061501.500m.jpg",,
473,,,,2006,"Oct 13:No vis hs in NC. In illawarra Vis hs with ???smoke GOOD EXAMPLE FOR LADY WHO CAN DISTINGUISH SMOKE FROM CLOUD!!!",,"Modis",,,,,,,,,,,,,,,,,,,,,"modis hotspot",,,,,,,,,,,"http://rapidfire.sci.gsfc.nasa.gov/realtime/single.php?2006286/crefl1_143.A2006286003001-2006286003500.500m.jpg",,
475,,,,2003,"Dec 25: Sydney: Castlereagh bush fire threa ‘minimal’",,"abc news online",,,,,,,,,,,,,,,,,,,,,"media","The New South Wales Rural Fire Service (RFS) says the potential for property damage from a large bush fire on Sydney's far north-western outskirts at Castlereagh is minimal.Fourteen fire crews from the RFS and the New South Wales Fire Brigade were called to the area around Tickner Road just before 2.00pm AEDT.It was feared the fire would threaten a number of rural and residential properties in the area.A spokeswoman for the RFS says the wind is pushing the fire away from the properties",,,,,,,,,,"http://www.abc.net.au/news/australia/wa/200312/s1016193.htm",,
612,,,,2006,"Dec 14: a couple hotspots in perth, no vis smoke",,"modis",,,,,,,,,,,,,,,,,,,,,"modis hotspot",,,,,,,,,,,"http://rapidfire.sci.gsfc.nasa.gov/realtime/single.php?2006348/crefl1_143.A2006348022001-2006348022501.500m.jpg",,
566,,,,2008,"sep 19:  several hs vis in nc, no vis smoke possible biomass",,"modis",,,,,,,,,,,,,,,,,,,,,"modis hotspot",,,,,,,,,,,"http://rapidfire.sci.gsfc.nasa.gov/realtime/single.php?2008263/crefl2_143.A2008263034001-2008263034500.250m.jpg",,
477,,,,2003,"Sep 5: Back burning creates smoke haze over Sydney",,"smh.com",,,,,,,,,,,,,,,,,,,,,"media","Sydneysiders woke to the smell of smoke today, as firefighters continued preparations for the opening of the statutory bush fire danger period on October 1.
The smoke haze over the city this morning came from a 373 hectare hazard reduction burn on the Cowan Track in Ku-ring-gai Chase National Park, a fire brigade spokesman said.The two day burn by the NSW Rural Fire Service (RFS) and National Parks and Wildlife Service (NPWS) is designed to provide strategic protection for Duffy's Forest and Terrey Hills this summer, and RFS spokesman said.It is also designed to reduce the intensity of any wildfires that may ignite in the Bobbin Head section of the park over the bushfire season.More smoke is expected over the weekend, from 35 hazard reduction burns planned for a 3,400 hectare area.An RFS spokesman said hundreds of RFS volunteers were preparing drip torches and firefighting equipment to reduce bushfire fuels in Baulkham Hills, Gosford, Hawkesbury, Sutherland, Warringah Pittwater, Wingecarribee and Wyong.",,,,,,,,,,"http://www.smh.com.au/articles/2003/09/05/1062549003806.html",,
561,,,,2007,"Oct 16: Fire crews fight bushfire at Mt Kembla",,"aap",,,,,,,,,,,,,,,,,,,,,"media","SYDNEY, Oct 16 AAP - Fire crews were working to control a bushfire near Wollongong 
today as windy and hot conditions put NSW Rural Fire Service (RFS) officers on alert. 

Twelve fire trucks were on the scene of a fire at Mt Kembla this morning, with air 
crews also expected to join the firefighting efforts, RFS spokesman Cameron Wade said. 

Strong westerly winds in the region were hampering conditions but the fire was no threat 
to residents, Mr Wade said. 

""A southerly change expected this afternoon can make things worse but afterwards it 
is usually cooler,"" he told AAP. 

""We are in for a very hot, dry, ...",,,,,,,,,,"http://www.highbeam.com/doc/1P1-144978358.html",,
478,,,,2007,"jan 22: Several hs vis with smoke in Newcastle region",,"modis",,,,,,,,,,,,,,,,,,,,,"modis smoke",,,,,,,,,,,"http://rapidfire.sci.gsfc.nasa.gov/realtime/single.php?2007022/crefl1_143.A2007022005000-2007022005501.500m.jpg",,
479,,,,2007,"jan 23: single hs vis in Sydney region with some visible smoke",,"modis",,,,,,,,,,,,,,,,,,,,,"modis smoke",,,,,,,,,,,"http://rapidfire.sci.gsfc.nasa.gov/realtime/single.php?2007023/crefl2_143.A2007023041001-2007023041500.500m.jpg",,
484,,,,2007,"march 3: Single, fairly large hs visible in illawarra- no visible smoke, possible biomass",,"modis",,,,,,,,,,,,,,,,,,,,,"modis hotspot",,,,,,,,,,,"http://rapidfire.sci.gsfc.nasa.gov/realtime/single.php?2007062/crefl1_143.A2007062000001-2007062000500.500m.jpg",,
480,,,,2007,"jan 28:several hotspots vis in Sydney and illawarra- no visible smoke. No hs vis in newcastle",,"modis",,,,,,,,,,,,,,,,,,,,,"modis hotspot",,,,,,,,,,,"http://rapidfire.sci.gsfc.nasa.gov/realtime/single.php?2007028/crefl1_143.A2007028001000-2007028001500.500m.jpg",,
481,,,,2007,"jan 29:large hotspot with vis smoke north of Newcastle, no vis hotspots in Sydney or illawarra region",,"modis",,,,,,,,,,,,,,,,,,,,,"modis smoke",,,,,,,,,,,"http://rapidfire.sci.gsfc.nasa.gov/realtime/single.php?2007029/crefl2_143.A2007029033500-2007029034000.500m.jpg",,
485,,,,2004,"April 3:Shell denies refinery fire sydney",,"The Age",,,,,,,,,,,,,,,,,,,,,"media","A fire which broke out at Sydney's Shell oil refinery was not considered suspicious and did not pose any risk to public safety, the company said.The fire broke out in a pipe track in the catalytic cracker unit at the Clyde refinery about 10.25pm (AEST) on Friday.The catalytic cracker unit, which had been shut down for planned maintenance when the blaze erupted, is used by the refinery to convert crude oil into refined petroleum products.The refinery's emergency response team assisted by 12 units from the NSW Fire Brigades were mobilised to isolate the area and used foam to extinguish the fire within an hour.Shell Clyde refinery acting manager Brian Cotterill said the fire had not affected production at the plant.",,,,,,,,,,"http://www.theage.com.au/articles/2004/04/03/1080941716618.html",,
482,,,"Jacobsen, Geesche",2004,"feb 11:Sydney Haze: Heat on, Lights out",,"smh.com",,,,,,,,,,,,,,,,,,,,,"media","After days of sweltering heat, Sydney was hit by a fierce electrical storm late last night that partially blacked out the CBD.
High-rise buildings and hotels in the centre of the city were plunged into darkness about 10.35pm, but the wet weather did little to cool things down - and the run of high temperatures is set to continue into the weekend when records of consecutive hot days could be broken.Sydney's west has endured a record six days over 36C culminating in 44C in Penrith yesterday - its hottest February day in the nine years since records have been kept. The city reached a high of 38C in mid-morning. with 36C in the city - bringing the seventh day over 29C. Penrith is expecting 41C.North to north-westerly air brought hot air from the inland. It swept away a haze caused by strong surface inversions, the Bureau of Meteorology said, but a southerly hit the city at lunchtime and the haze returned.The Rural Fire Service reported no serious bushfires. Water consumption was above average and dam levels were expected to fall this week. However, a Sydney Catchment Authority spokeswoman said humidity was expected to have curbed evaporation. Warragamba Dam, which was at 56.5 per cent of capacity at the beginning of the year, was expected to drop to just over 53 per cent when weekly figures are released today",,,,,,,,,,"http://www.smh.com.au/articles/2004/02/11/1076388445887.html",,
487,,,,2007,"oct 1: hotspots vis with vis smoke north of Sydney hs south in illawrra and north in Newcastle as well",,"modis",,,,,,,,,,,,,,,,,,,,,"modis smoke",,,,,,,,,,,"http://rapidfire.sci.gsfc.nasa.gov/realtime/single.php?2007274/crefl2_143.A2007274035000-2007274035500.250m.jpg",,
483,,,,2007,"jan 31: Two hs visible north of Newcastle, no vis smoke, possible biomass",,"modis",,,,,,,,,,,,,,,,,,,,,"modis hotspot",,,,,,,,,,,"http://rapidfire.sci.gsfc.nasa.gov/realtime/single.php?2007031/crefl2_143.A2007031032001-2007031032500.500m.jpg",,
486,,,,2004,"may 8: NSW: Penrith factory blaze under control",,"aap",,,,,,,,,,,,,,,,,,,,,"media","SYDNEY, May 8 AAP - Firefighters will continue to monitor a blaze which destroyed a 
factory in Sydney's west today, causing several million dollars worth of damage. 
NSW Fire Brigades spokesman Ian Krimmer said the blaze at Jamisontown, at Penrith, 
was brought under control about 12.30pm (AEST). 
The single level factory, at Pattys Place, contained packaging material and telecommunications 
equipment, he said. 
""It will smoulder for most of the night,"" Mr Krimmer said. 
""We have 80 firefighters from 12 surrounding areas attending the blaze. 
""It has caused several ...",,,,,,,,,,"http://www.highbeam.com/doc/1P1-94379183.html",,
491,,,,2004,"oct 12: NSW bushfire breakout alert",,"smh.com",,,,,,,,,,,,,,,,,,,,,"media","A huge bushfire burning in northern NSW for 24 hours has been contained on some fronts but firefighters are continuing to battle several breakouts.The Rural Fire Service is working to bring the blaze under control as quickly as possible with hotter weather conditions predicted around the area tomorrow.A fire spokeswoman said more than 1,000 hectares of land, including 900 hectares of private property, 10km south-east of Woodburn, has been burnt out.Four helicopters were involved in the battle and more crews were expected to attend as the fire entered the top end of Bundjalung National Park today, she said.The spokeswoman said the fire, which was reported shortly before 3pm (AEST) yesterday, had been contained in the north-west and was under control on the western side but crews were still working on the east and north-eastern sectors.""Firefighters are working really hard to get containment, it will be an extensive operation over the next couple of days,"" she said.""I believe it has just entered the top end of the Bundjalung National Park.""There are no properties in the area but we are trying to stop it from entering the park.""The spokeswoman added that worse bushfire conditions were expected tomorrow.""We have had some quite high temperatures here today, it's hit the mid- to late-30s with a low humidity,"" she said.""Tomorrow's weather is expected to be worse than today's, so we'll see what tomorrow brings and have a better idea then of how long it will take to contain the fire.""Another bushfire was reported near the Grand Parade in Sutherland, southern Sydney, this afternoon.A NSW Fire Brigade spokesman said seven Rural Fire Service tankers were tackling the blaze, which was burning within containment lines.No properties were in immediate danger, he said.",,,,,,,,,,"http://www.smh.com.au/articles/2004/10/12/1097406560030.html?from=storylhs",,
492,,,,2004,"oct 13: Fires break out as temperatures soar",,"smh.com",,,,,,,,,,,,,,,,,,,,,"media","Record temperatures scorched Sydney today, as dozens of fires charred NSW and marked the start of another gruelling bushfire season.The temperature at Observatory Hill in the CBD reached 38.2 degrees Celsius by mid-afternoon, making it Sydney's hottest October day since records began a century and a half ago.The month's previous hottest day was more than six decades ago - October 4, 1942 - when the temperature in Sydney's CBD peaked at 37.4 degrees.""I think it's going to be a little bit cooler tomorrow but still fairly hot,"" said a weather bureau spokesman.Outside the city, some 25 spot fires raged from Nowra on the state's south coast to the central coast and the Hunter Valley.The worst blaze encroached on the outskirts of several rural properties and seriously threatened hundreds of homes in suburban North Nowra. Two sheds were destroyed.The blaze, which destroyed over 200 hectares of bushland and was expected to rage overnight, forced the evacuation of at least 50 people.About 100 firefighters from the NSW Fire Brigades and Rural Fire Service were working into the night to control the flames with the help of three helicopters.Another serious inferno, at Morisset near Newcastle north of Sydney, claimed 100 hectares of bushland and threatened the main Sydney-Newcastle rail line, which was closed briefly.After emergency services were called in about 11am (AEST), about 100 firefighters from the NSW Fire Brigades and Rural Fire Service managed to bring the fire under control by late afternoon.""Any day like today is going to produce fires of high intensity and they'll also be fast moving,"" NSW Fire Brigades spokesman Inspector Gordon Boath said.He said the high-risk conditions brought by the heat were made worse by the dryness of the fuel.A total fire ban was declared for most of central and eastern NSW until at least midnight tonight.",,,,,,,,,,"http://www.smh.com.au/articles/2004/10/13/1097607257054.html",,
592,,,,2009,"Feb 7: Homes under threat from raging bushfires sydney",,"The Australian",,,,,,,,,,,,,,,,,,,,,"media","TWO homes are under threat from a grass fire in the NSW's north and a bushfire is rapidly burning west of the F3 freeway near Wiseman's Ferry Rd on the NSW Central Coast.

An RFS spokeswoman said two fixed wing water bombing planes were battling the blaze at properties on the northern outskirts of Inverell from about 2pm (AEDT) on Saturday.

""These two properties under threat,"" the spokeswoman said.

No one has been evacuated and property owners are working with the RFS to protect the properties.

She said it was too early to say whether the fire could be brought under control.

An RFS spokeswoman said road closures were expected in the Somersby area on the Central Coast.

Temperatures have already reached more than 41 degrees in Sydney's west with winds beginning to strengthen up to 30km/h in the west of the city.

The west and south west of the state is expected to swelter in mid-forties heat.

Sydney reached its expected maximum of 33 degrees by 2.30pm (AEDT) with 33 km/h winds.

The mercury at Richmond and Penrith on the western outskirts of the city reached more than 41 degrees with 25 to 30km/h winds.

More than 40 fires are burning throughout the state, with authorities concerned about fires at Muswellbrook, Tumut, the Bega Valley, Wybong in the Hunter Valley and Wollemi National Park in the Singleton area.

A bushfire burning out of control near Muswellbrook in the NSW Hunter region has burnt out more than 300 hectares of bushland.

In the south of the state a fire has burnt out more than 2,000 hectares of the Budawang National Park.

Fire investigators are examining the scene at Wollemi National Park in the Singleton area to determine the cause of the fires which have burnt more than 1000 hectares of countryside since Friday night.

The fires have joined as one and are moving rapidly under hot and windy summer conditions.

The fire is burning out of control approximately 25km northwest of Putty and 44km south of Denman in the Hunter Valley but no property is under threat.",,,,,,,,,,"http://www.theaustralian.news.com.au/story/0,25197,25020939-12377,00.html",,
593,,,,2009,"Feb 6: Australia drops water bombs on raging bush fires",,"reuters",,,,,,,,,,,,,,,,,,,,,"media","SYDNEY, Feb 7 (Reuters) - Aircraft dropped water bombs on raging Australian bush fires on Saturday as a ""once in a century"" heatwave sparked dozens of blazes across the country.

Wildfires are a natural annual event in Australia, but this year is one of the worst in living memory, a combination of scorching weather, a lack of rain and tinder-dry bush.

Local media have said it is a ""once in a century heatwave"" and among the worst in living memory.

Officials said said dozens of fires were blazing across the country's densely populated southeast, and police said at least one that hit Sydney's metropolitan area late on Friday had been deliberately lit.

As temperatures in Melbourne soared to 45 degrees Celsius (113 Fahrenheit) on Saturday, a major fire east of the city had burned more than 160 hectares of parkland after jumping containment lines overnight.

Authorities warned nearby residents to be on alert and a Reuters photographer at the scene said aircraft were water-bombing spot fires that were breaking out ahead of the main front.

""It is extremely dry. We do have some concern about the winds picking up and having an impact on the fire,"" a spokesman for Victoria state's Country Fire Authority told Reuters.

An ""urgent threat message"" was posted for local communities to be prepared to be hit by fire. Threat notices were also issued for several other areas, while another fire which broke out in the morning was close to the main highway between Melbourne and Sydney.

In New South Wales, authorities said more than 40 fires were burning, with bushfire emergencies declared in several places. Smoke covered many areas of Sydney, which came under threat from two fires late on Friday.

ARSON SUSPECTED

Police blamed a fire that broke out in the inner-Sydney district of Lane Cove on Friday night on arson. The fire burnt several hectares of a national park within the Sydney metropolitan area, threatening nearby homes.

Researchers say around half of the bushfires in Australia are deliberately lit.

Another fire in the Wollemi national park, the home of the famous 'living fossil', the Wollemi pine, had destroyed 1,000 hectares of forest northwest of Sydney, a spokeswoman for the New South Wales state Rural Fire Service told Reuters.

""The fire is moving quite quickly,"" spokeswoman Rebel Talbert said, adding that a bushfire emergency had been declared there and aircraft with water bombs were trying to bring it under control.

Another blaze near the coast south of Sydney had jumped containment lines and was proving hard to control. Authorities in South Australia said they were tackling a fire near the southern community of Mount Gambier.

The heatwave has caused a spate of heat-related deaths, which has left morgues struggling to cope, while transport and power services have repeatedly broken down in the hot weather.",,,,,,,,,,"http://www.reuters.com/article/idUSB139060",,
493,,,,2007,"oct 5: Hotspots visible north and south of Newcastle with visible smoke (west Sydney vis hs with smoke)",,"modis",,,,,,,,,,,,,,,,,,,,,"modis smoke",,,,,,,,,,,"http://rapidfire.sci.gsfc.nasa.gov/realtime/single.php?2007278/crefl2_143.A2007278032500-2007278032959.250m.jpg",,
